<?xml version="1.0" encoding="UTF-8" ?>

<xs:schema xmlns:xs="http://www.w3.org/2001/XMLSchema">

	<xs:element name="books">
		<xs:complexType>
			<xs:sequence>
				<xs:element name="book" maxOccurs="unbounded">
					<xs:complexType>
						<xs:sequence>
							<xs:element name="title" type="xs:string" />
						</xs:sequence>
						<xs:attribute name="show" use="required">
							<xs:simpleType>
								<xs:restriction base="xs:string">
									<xs:enumeration value="yes" />
									<xs:enumeration value="no" />
								</xs:restriction>
							</xs:simpleType>
						</xs:attribute>
					</xs:complexType>
				</xs:element>

				<xs:element name="owner" type="xs:string" />
			</xs:sequence>
		</xs:complexType>
	</xs:element>
</xs:schema>